{
  "schema": "atlas.story-context.v1",
  "contextId": "story-context.eleven-views.desk",
  "version": "1.0.0",
  "status": "approved",
  "scope": { "companyId": "eleven-views", "productId": "desk" },
  "identity": {
    "name": "Eleven Views",
    "domain": "elevenviews.io",
    "productFamilies": ["Atlas", "Desk", "Tools", "Audio"],
    "logoAssetRefs": ["asset.logo.eleven-views-light"]
  },
  "brand": {
    "colors": { "background": "near-black", "text": "white", "accent": "restrained-blue" },
    "typography": { "display": "approved-display", "body": "approved-body" },
    "styleRules": ["Use the real product interface as the hero", "Keep copy minimal", "Do not use gold accents"]
  },
  "productContextRef": "product-context.desk.2026-08-23",
  "audiences": [
    {
      "audienceId": "audience.agency-owner",
      "name": "Agency owner",
      "problems": ["AI actions are difficult to govern and verify"],
      "desiredOutcomes": ["See what agents did and approve consequential actions"],
      "objections": ["AI should not have unrestricted access to the Mac"]
    }
  ],
  "messaging": {
    "positioning": "A governed operating layer for agents working across real company systems.",
    "approvedMessages": ["Agents work within governed approvals"],
    "disallowedMessages": ["Fully autonomous company"],
    "voiceRules": ["Use short natural sentences", "State what works now first"],
    "ctaPatterns": ["See Desk in action"]
  },
  "claims": [
    {
      "claimId": "claim.capture-verified",
      "text": "Capture-to-Desk verifies the stored attachment bytes after upload.",
      "status": "approved",
      "evidenceRefs": ["proof.capture-to-desk"],
      "sourceRefs": ["source.tools-pr-10"],
      "approvedBy": "simeon-reid",
      "approvedAt": "2026-08-23T20:00:00Z"
    }
  ],
  "proof": [
    {
      "assetId": "proof.capture-to-desk",
      "kind": "document",
      "uri": "https://github.com/Dongetabag/eleven-views-tools/pull/10",
      "sha256": "1111111111111111111111111111111111111111111111111111111111111111",
      "bytes": 1,
      "mediaType": "text/html",
      "privacy": "public"
    }
  ],
  "presenterRefs": ["presenter.simeon-founder"],
  "channels": {
    "website": { "aspectRatio": "16:9", "cta": "See Desk in action" },
    "linkedin": { "aspectRatio": "9:16", "maxSeconds": 45 }
  },
  "visualRules": ["Use actual software UI for functionality", "Presenter photo appears only during narration"],
  "audioRules": ["Normalize narration through Eleven Views Audio", "Duck music under narration"],
  "terminology": [
    { "term": "Desk", "rule": "Capitalize when referring to Eleven Views Desk" },
    { "term": "agents", "rule": "Do not call agents AI employees" }
  ],
  "privacyRules": {
    "defaultClassification": "company",
    "blockedPatterns": ["credentials", "tokens", "client personal data"],
    "prohibitedScreens": ["password managers", "private client records"],
    "externalProviderRules": ["Send only approved narration text to voice providers"]
  },
  "sourceRefs": [
    {
      "sourceId": "source.tools-pr-10",
      "kind": "github",
      "label": "Capture-to-Desk hardening pull request",
      "uri": "https://github.com/Dongetabag/eleven-views-tools/pull/10",
      "observedAt": "2026-08-23T20:00:00Z",
      "confidence": "high",
      "derivation": "observed",
      "approvedBy": "simeon-reid",
      "approvedAt": "2026-08-23T20:00:00Z"
    }
  ],
  "verifiedAt": "2026-08-23T20:00:00Z",
  "approvedBy": "simeon-reid"
}
